{"contract_role":"PUBLIC_PLATFORM_TELEMETRY","expected_build":"21.0.11+10-LTS/Microsoft-13877187","expected_vendor":"Microsoft","expected_version":"21.0.11","invocation_policy_hash":"d840e45428882835511350c69239c669b76f1af55644a03a2be9a189c3790235","normalized_version_banner_hash":"1f41f3f8730a1908a6791ee3c6f55150e6676a801e9726b07d3aab6fb606180c","observed_java_binary_hash":"33cb6bc705a5c7e6ed16aed1b149c61802a787cfe8f2868b651d596c82a4c4a6","observed_javac_binary_hash":"729af9d119492aa44957e3138dcae029ed08e10b06a33cb23a879d7819bb8740","observed_release_file_hash":"4ffc87a948c01a9fb035ded3b626c7987ff13a6c94bafcd59f64bbe3cbd2fa45","platform_role":"karina","provider_id":"m336.microsoft-openjdk-21.0.11+10","provider_manifest_hash":"f4df5e89c932731b914f4d2c26df77535e569cac4bb1a745d58a02211d189eeb","receipt_hash":"b69bc5736c3a5f16871e7407e414d13d936ed036a9a237b43d98a3c4cc5a28b3","schema_version":1,"semantic_compiler_identity_hash":"3ccdf9ac1127058ae9152c913fa03f246b860227bee28e4ca69f4418358c231f","target_java_release":21,"verification_status":"PASS"}
